created_at;id_str;full_text;quote_count;reply_count;retweet_count;favorite_count;lang;user_id_str;conversation_id_str;username;tweet_url
Sat Dec 02 10:06:51 +0000 2023;1730891267696120202;"Calon Presiden nomor urut 3, @ganjarpranowo  disambut antusias para mahasiswa di Universitas San Pedro, Kupang, Nusa Tenggara Timur. Di hadapan mahasiswa, Ganjar berbicara tentang pentingnya pemerataan akses pendidikan bagi kemajuan bangsa dan kepekaan sosial  #SalamTigaJari… https://t.co/6EVzw3ne1s";0;0;0;0;in;1461544752688418820;1730891267696120202;BestieGanjar;https://twitter.com/BestieGanjar/status/1730891267696120202
Sat Dec 02 10:06:51 +0000 2023;1730891267645796536;"Sukses selalu, Pak Ganjar! Semoga terus ada pemimpin yang peduli terhadap perkembangan pendidikan di tanah air. @od_gion  GPMMD 4Ende https://t.co/WHh5WBHJ9Z";0;0;0;0;in;1681180044331188224;1730891267645796536;AimannRusli;https://twitter.com/AimannRusli/status/1730891267645796536
Sat Dec 02 10:06:39 +0000 2023;1730891216676635093;"@xquitavee Hari² anda serang pdip dan ganjar,  artinya apa?  Ganjarlah yg menakutkan bagi kubu anda.  Paham!";0;0;0;0;in;1078634775705866240;1730874481512718363;Ola56291826;https://twitter.com/Ola56291826/status/1730891216676635093
Sat Dec 02 10:06:38 +0000 2023;1730891214365524452;"Dukungan penuh untuk Pak Ganjar yang ingin menciptakan lulusan yang tidak hanya cerdas di akademis, tetapi juga memiliki keunggulan di dunia usaha. Langkah progresif! @MR_Rodiiii  GPMMD 4Ende https://t.co/oJ5cySNwil";0;0;0;0;in;1688458065635651584;1730891214365524452;YogiOktv;https://twitter.com/YogiOktv/status/1730891214365524452
Sat Dec 02 10:06:36 +0000 2023;1730891204932534575;"Ganjar Pranowo menerima dua buku dari Franz Magnis dengan judul "Etika Politik" dan "Iman Dalam Tantangan". Kira-kira nyindir siapa tuh, ada yang tahu?  #MMA2023withNCTDREAM #BRISE 😆 https://t.co/VmQ1YK8C46";0;0;0;0;in;1633360160407310336;1730891204932534575;CilokKila;https://twitter.com/CilokKila/status/1730891204932534575
Sat Dec 02 10:06:35 +0000 2023;1730891202378223721;"Pendidikan adalah pondasi utama, dan Pak Ganjar membangunnya dengan komitmen yang luar biasa. @dioprtmaaa  GPMMD 4Ende https://t.co/NHkS4LIuny";0;0;0;0;in;1689492935019286528;1730891202378223721;diktairawan;https://twitter.com/diktairawan/status/1730891202378223721
Sat Dec 02 10:06:32 +0000 2023;1730891188495139073;"@ex_AnakLolina Ganjar selalu membar dg masyarakat";0;0;1;0;in;1053271569877749760;1730884757712765246;mikuroQ;https://twitter.com/mikuroQ/status/1730891188495139073
Sat Dec 02 10:06:31 +0000 2023;1730891185567445262;"Pak Ganjar, teruskan langkah untuk mencapai target 30 juta wisatawan mancanegara. Sukses untuk semua upaya yang telah dan akan dilakukan! @rossy_triska  GPMMD 4Ende https://t.co/Qc0N9cEh3Q";0;0;0;0;in;1687325310357057536;1730891185567445262;dimprayog;https://twitter.com/dimprayog/status/1730891185567445262
Sat Dec 02 10:06:31 +0000 2023;1730891184917426273;"Pak Ganjar, pendidikan adalah kunci kesuksesan, dan Anda membuka pintu kesuksesan bagi banyak anak muda. @Mazzyalfandi_19  GPMMD 4Ende https://t.co/b4cgRhW30p";0;0;0;0;in;1684556906520776705;1730891184917426273;eerkfirdaus;https://twitter.com/eerkfirdaus/status/1730891184917426273
Sat Dec 02 10:06:30 +0000 2023;1730891178516557824;"@barisoegriwa @SATIRE66 @Paltiwest Mereka takutnya sama Ganjar...";0;0;0;0;in;36592987;1730522239760806404;shevake;https://twitter.com/shevake/status/1730891178516557824
Sat Dec 02 10:06:28 +0000 2023;1730891172762243300;"Membangun jembatan antara pendidikan dan dunia usaha adalah langkah maju yang sangat diperlukan. Semoga usaha Pak Ganjar mendapatkan hasil positif. @OckyAndrianes  GPMMD 4Ende https://t.co/br65BlHKiR";0;0;0;0;in;1689842681902698498;1730891172762243300;ElmaIvanka;https://twitter.com/ElmaIvanka/status/1730891172762243300
Sat Dec 02 10:06:22 +0000 2023;1730891144945656006;"Ganjar Pranowo menerima dua buku dari Franz Magnis dengan judul "Etika Politik" dan "Iman Dalam Tantangan". Kira-kira nyindir siapa tuh, ada yang tahu?  #MMA2023withNCTDREAM #BRISE 😁 https://t.co/5dunhXCu0q";0;1;0;0;in;1633358091533295616;1730891144945656006;lalaanas6;https://twitter.com/lalaanas6/status/1730891144945656006
Sat Dec 02 10:06:21 +0000 2023;1730891141955060007;"Pak Ganjar mengajarkan bahwa kebersamaan adalah pondasi yang kokoh untuk membangun bangsa yang besar. @gaaatannn  GPMMD 4Ende https://t.co/6FYTy2VAaO";0;0;0;0;in;1683724071534739457;1730891141955060007;irfann_dwie;https://twitter.com/irfann_dwie/status/1730891141955060007
Sat Dec 02 10:06:19 +0000 2023;1730891133335769265;"Terima kasih, Pak Ganjar, karena membawa perubahan positif dan memberikan harapan baru bagi generasi muda Indonesia. Sukses selalu! @ocepane  GPMMD 4Ende https://t.co/JSoVVPD8tb";0;0;0;0;in;1681887549969793024;1730891133335769265;Rosmayanti122;https://twitter.com/Rosmayanti122/status/1730891133335769265
Sat Dec 02 10:06:17 +0000 2023;1730891126750814646;"@AlissaWahid @GUSDURians Klo dukungnya ganjar-mahfud gpp ya?";0;0;0;0;in;1099574429216960512;1730852175721697437;planktonneverdy;https://twitter.com/planktonneverdy/status/1730891126750814646
Sat Dec 02 10:06:15 +0000 2023;1730891117103833566;"Masyarakat lokal memiliki potensi besar dalam menghidupkan destinasi wisata. Terima kasih kepada Pak Ganjar dan Pak Mahfud MD yang memberdayakan mereka. @raihannrrahman  GPMMD 4Ende https://t.co/q4YW3OiPoE";0;0;0;0;in;1690431326007238656;1730891117103833566;priatnaad;https://twitter.com/priatnaad/status/1730891117103833566
Sat Dec 02 10:06:13 +0000 2023;1730891108044197965;"Ganjar Pranowo menerima dua buku dari Franz Magnis dengan judul "Etika Politik" dan "Iman Dalam Tantangan". Kira-kira nyindir siapa tuh, ada yang tahu?  #MMA2023withNCTDREAM #BRISE 😘 https://t.co/U8n1tvuzjf";0;1;0;0;in;1590515883327115264;1730891108044197965;tita_evi;https://twitter.com/tita_evi/status/1730891108044197965
Sat Dec 02 10:05:55 +0000 2023;1730891034388033878;"Pak Ganjar memberikan teladan bahwa pemimpin sejati adalah mereka yang dekat dengan rakyatnya. @Gagan_telan  GPMMD 4Ende https://t.co/gyPG20J2FQ";0;0;0;0;in;1683555529527001088;1730891034388033878;hilmanandr_;https://twitter.com/hilmanandr_/status/1730891034388033878
Sat Dec 02 10:05:52 +0000 2023;1730891021687636018;"@Leony_aja Yang pasti dukung yang pasti Ganjar Mahfud Cr3ative";0;0;0;0;in;1650360198526304262;1730830095861059626;gatauahcape;https://twitter.com/gatauahcape/status/1730891021687636018
Sat Dec 02 10:05:35 +0000 2023;1730890950279627244;"@Dennysiregar7 Halah....cangkemu Cuk , coba Joko dukung ganjar , kalian pasto diam dan tetap menjilat menutupi apa yg di omongkan mantan ketua KPK";0;0;0;1;in;1603583313142091776;1730615690275754087;kimi198021;https://twitter.com/kimi198021/status/1730890950279627244
Sat Dec 02 10:05:30 +0000 2023;1730890929974993330;"Langkah tegas Pak Ganjar dan Pak Mahfud MD dalam melawan kejahatan lingkungan hidup patut dicontoh. Semoga pesan ini menginspirasi kesadaran lingkungan di seluruh masyarakat. @Hirul1995  GPMMD 4Ende https://t.co/wPCV6yft7P";0;0;0;0;in;1686947455978655744;1730890929974993330;mlnazril10;https://twitter.com/mlnazril10/status/1730890929974993330
Sat Dec 02 10:05:30 +0000 2023;1730890929735971128;"Masyarakat lokal memiliki peran penting dalam menjaga keberlanjutan destinasi wisata. Terima kasih kepada Pak Ganjar dan Pak Mahfud MD yang memahami hal ini. @rahmatanwar2801  GPMMD 4Ende https://t.co/e1b88dgkRv";0;0;0;0;in;1685297586796978176;1730890929735971128;selviakrnwtii;https://twitter.com/selviakrnwtii/status/1730890929735971128
Sat Dec 02 10:05:29 +0000 2023;1730890924807610514;"Melalui pendekatan yang holistik, Pak Ganjar menciptakan landasan pendidikan yang lebih kuat bagi anak bangsa. @NCFsleman  GPMMD 4Ende https://t.co/cTkYOKFzCd";0;0;0;0;in;1688399311363784704;1730890924807610514;gita_ivanka;https://twitter.com/gita_ivanka/status/1730890924807610514
Sat Dec 02 10:05:23 +0000 2023;1730890901420171675;"Repost dari Capres yang diusung Partai Perindo -- Bapak Ganjar Pranowo  (@ganjarpranowo)  https://t.co/6DSRZMBEkU  #Ganjar  #GanjarPranowo #HitamPutih #HitamPutihGanjar #GerakCepatGanjarMahfud #IndonesiaLebihBaik https://t.co/uB0GjiOKPD";0;0;0;0;in;543264218;1730890901420171675;GTVID_News;https://twitter.com/GTVID_News/status/1730890901420171675
Sat Dec 02 10:05:23 +0000 2023;1730890897632739524;"Anak muda adalah kekuatan bangsa, dan Pak Ganjar memberikan perhatian yang pantas untuk memajukannya. @dio_nurdiansyah  GPMMD 4Ende https://t.co/KaxLNvYxyP";0;0;0;0;in;1689132314654294017;1730890897632739524;nadiasftrrrr2;https://twitter.com/nadiasftrrrr2/status/1730890897632739524
Sat Dec 02 10:05:20 +0000 2023;1730890887155290248;"Pak Ganjar, teruslah menjadi pionir dalam membawa kedekatan antara pemerintah dan rakyat menjadi kenyataan. @GABRIELLADALE2  GPMMD 4Ende https://t.co/WyldaQ0Urp";0;0;0;0;in;1683959163356082180;1730890887155290248;hiromaraa;https://twitter.com/hiromaraa/status/1730890887155290248
Sat Dec 02 10:05:14 +0000 2023;1730890863625035888;"Ganjar pranowo menyaksikan pagelatan tradisi pacuan kuda HUS di Pulau Rote, NTT  #TuankuRakyat #GanjarMediaCenter #GPMDForRI1 https://t.co/IJ95zyqEbV";0;0;0;0;in;1715586793859690496;1730890863625035888;DulurGM2024;https://twitter.com/DulurGM2024/status/1730890863625035888
Sat Dec 02 10:05:12 +0000 2023;1730890854213259512;"Repost dari Capres yang diusung Partai Perindo -- Bapak Ganjar Pranowo  (@ganjarpranowo)  https://t.co/u96HDTo8aa  #Ganjar  #GanjarPranowo #HitamPutih #HitamPutihGanjar #GerakCepatGanjarMahfud #IndonesiaLebihBaik https://t.co/HKyFYacTdj";0;0;0;0;in;61377303;1730890854213259512;Lintas_MNCTV;https://twitter.com/Lintas_MNCTV/status/1730890854213259512
Sat Dec 02 10:05:08 +0000 2023;1730890838270759188;"Dukungan penuh untuk upaya Pak Ganjar dan Pak Mahfud MD dalam meningkatkan kualitas destinasi wisata. Semoga memberikan dampak positif yang besar. @Raihan54172931  GPMMD 4Ende https://t.co/bmZbT3cUIL";0;0;0;0;in;1686308289456566272;1730890838270759188;AndrianYus;https://twitter.com/AndrianYus/status/1730890838270759188
Sat Dec 02 10:05:08 +0000 2023;1730890834902732870;"Pak Ganjar Datang ke Ende, langsung disambut Tarian dan Pengalungan selendang.  Semangat terus Pak, kami selalu mendukung Bapak Dimanapun Bapak berada 🤟  #SahabatGanjar #GanjarPranowo #Ganjar #GenerasiGotongRoyong #GanjarPresiden #GanjarUntukSemua #GanjarMahfud2024 https://t.co/G7g4T7cA7w";0;0;0;1;in;2497018502;1730890834902732870;125Japstyle;https://twitter.com/125Japstyle/status/1730890834902732870
Sat Dec 02 10:05:06 +0000 2023;1730890829814985087;"@zoelfick Pangusaha pun ditekan utk tidak mendukung pasangan Ganjar-Mahfud";0;0;0;3;in;1548530637945982979;1730885460761977158;luckylucky0971;https://twitter.com/luckylucky0971/status/1730890829814985087
Sat Dec 02 10:05:04 +0000 2023;1730890819509641710;"Tanggapi Soal Format Debat Capres-Cawapres, TPN Ganjar-Mahfud: Menyimpang dari Ketentuan https://t.co/hJSatKbdFv";0;0;0;1;in;903229236051247104;1730890819509641710;eradotid;https://twitter.com/eradotid/status/1730890819509641710
Sat Dec 02 10:05:01 +0000 2023;1730890806133956897;"@Mukidi02934222 @PartaiSocmed Mngkin tu pndukung yg nyamar bwt adu domba wkwk slama bkn sikap dr tpn tu ga masalah..Smua bisa bikin kok dg AI smisal lo pndukung lgbt + pndukung ganjar n lo bikin gmbar ganjar dg AI pke simbol lgbt..Apa tu dianggap sikap ganjar trhadap lgbt?? Kan gak kan wkwk";0;1;0;1;in;1715466972325105664;1730846106316378408;luxmentis69;https://twitter.com/luxmentis69/status/1730890806133956897
Sat Dec 02 10:04:59 +0000 2023;1730890799729320378;"Dukungan penuh untuk langkah progresif Pak Ganjar dan Pak Mahfud MD. Semoga pariwisata daerah semakin berkembang dan memberikan manfaat maksimal. @Rahmawatisanti8  GPMMD 4Ende https://t.co/P6L5p5Sho9";0;0;0;0;in;1690423437591035905;1730890799729320378;prmidaaayu;https://twitter.com/prmidaaayu/status/1730890799729320378
Sat Dec 02 10:04:59 +0000 2023;1730890798248624499;"Repost dari Capres yang diusung Partai Perindo -- Bapak Ganjar Pranowo  (@ganjarpranowo)  https://t.co/GrLuVMwBsl  #Ganjar  #GanjarPranowo #HitamPutih #HitamPutihGanjar #GerakCepatGanjarMahfud #IndonesiaLebihBaik https://t.co/DVMoZScd6d";0;0;0;0;in;375995332;1730890798248624499;SeputariNews;https://twitter.com/SeputariNews/status/1730890798248624499
Sat Dec 02 10:04:58 +0000 2023;1730890794775859530;"@ganjarpranowo Senang banget Masya Allah masyarakat Kupang penuh hangat menyambut Pak Ganjar dan penuh kegembiraan 🥰";0;0;1;2;in;1704534824890023939;1730825211342405780;LoganNelso77678;https://twitter.com/LoganNelso77678/status/1730890794775859530
Sat Dec 02 10:04:44 +0000 2023;1730890735392813340;"Repost dari Capres yang diusung Partai Perindo -- Bapak Ganjar Pranowo  (@ganjarpranowo)  https://t.co/DQwCXFEOna  #Ganjar  #GanjarPranowo #HitamPutih #HitamPutihGanjar #GerakCepatGanjarMahfud #IndonesiaLebihBaik https://t.co/vjiFTfG8GM";0;0;0;0;in;132078023;1730890735392813340;officialinews_;https://twitter.com/officialinews_/status/1730890735392813340
Sat Dec 02 10:04:28 +0000 2023;1730890670129500430;"Mahfud MD dan Ganjar patut mendapat pujian atas usaha mereka menciptakan pendidikan yang lebih relevan dan adaptif. Semoga anak-anak kita meraih keberhasilan besar. @phartathea77  GPMMD 4Ende https://t.co/S4vKtOas0G";0;0;0;0;in;1681872185823219712;1730890670129500430;abdlazizz06;https://twitter.com/abdlazizz06/status/1730890670129500430
Sat Dec 02 10:04:27 +0000 2023;1730890662567125125;"Semangat Pak Ganjar yang ingin memberikan akses pendidikan tanpa batas menunjukkan dedikasinya terhadap pembangunan bangsa melalui pemahaman akan pentingnya ilmu. @Kongsi_Jahat_  GPMMD 4Ende https://t.co/H21mqLit7F";0;0;0;0;in;1681894891792789505;1730890662567125125;ZailaniYus;https://twitter.com/ZailaniYus/status/1730890662567125125
Sat Dec 02 10:04:22 +0000 2023;1730890642061152376;"Ganjar dan Mahfud MD, semoga program kebebasan minat ini mengubah wajah pendidikan Indonesia menjadi lebih dinamis dan relevan. Terima kasih atas dedikasi kalian. @pesex03  GPMMD 4Ende https://t.co/dq3AC33Dgi";0;0;0;0;in;1689855474190204928;1730890642061152376;YoviMaulida;https://twitter.com/YoviMaulida/status/1730890642061152376
Sat Dec 02 10:04:18 +0000 2023;1730890625556639973;"Terima kasih Ganjar atas dedikasinya dalam menciptakan pendidikan yang lebih inklusif. Semoga program ini menciptakan anak-anak yang memiliki visi dan semangat untuk meraih impian mereka. @mr_bushido99  GPMMD 4Ende https://t.co/ra7zWpj0QX";0;0;0;0;in;1688768482433990656;1730890625556639973;DikiFerdiian;https://twitter.com/DikiFerdiian/status/1730890625556639973
Sat Dec 02 10:04:16 +0000 2023;1730890616836641256;"Keberanian Pak Ganjar dan Pak Mahfud MD layak diapresiasi. Semoga upaya mereka memberikan efek jera bagi para pelaku kejahatan. @himurakin  GPMMD 4Ende https://t.co/eeOLH1sYYU";0;0;0;0;in;1687072658272477184;1730890616836641256;zfrasbla;https://twitter.com/zfrasbla/status/1730890616836641256
Sat Dec 02 10:04:15 +0000 2023;1730890614169022836;"Mendukung penuh langkah-langkah Pak Ganjar yang menjadikan anak muda sebagai prioritas utama, mengukuhkan harapan akan masa depan yang lebih baik. @EkyAkbarFauzi  GPMMD 4Ende https://t.co/NUtHjZbbSg";0;0;0;0;in;1689195987863248897;1730890614169022836;HidayatHeruuuu;https://twitter.com/HidayatHeruuuu/status/1730890614169022836
Sat Dec 02 10:04:10 +0000 2023;1730890592497127620;"@MbahSulurKra @kurawa Utk banjir rob. Namanya banjir rob kalo laut pasang, ya banjir itu tiba. Makin pasang, makin rob. Itu bukan salah Gub. Nyalahin lautpun akan dikira bodoh. Ganjar akan salah jika misalnya ada anggaran tanggul pantai tapi ga dikerja, baru salah. Justru Gnjar ingin tanggul itu ada!";0;0;0;0;in;1681943465050132480;1730779585728655799;PocoRedmip3397;https://twitter.com/PocoRedmip3397/status/1730890592497127620
Sat Dec 02 10:04:08 +0000 2023;1730890583206732211;"Keinginan Pak Ganjar dan Pak Mahfud MD untuk memberikan hak pendidikan kepada semua anak muda adalah cita-cita yang patut diapresiasi. @lupabobokkk  GPMMD 4Ende https://t.co/M9Dt6kGHLz";0;0;0;0;in;1684557946615889920;1730890583206732211;aainist;https://twitter.com/aainist/status/1730890583206732211
Sat Dec 02 10:04:05 +0000 2023;1730890571215233025;"Ganjar memberikan kontribusi besar dengan membuka ruang bagi anak-anak Indonesia untuk mengembangkan minat mereka. Semoga program ini menjadi landasan bagi karir sukses mereka. @PFF1923  GPMMD 4Ende https://t.co/j2TaR7vnnc";0;0;0;0;in;1689842754711597056;1730890571215233025;RioGunawaann;https://twitter.com/RioGunawaann/status/1730890571215233025
Sat Dec 02 10:04:01 +0000 2023;1730890557579501760;"@FransAlosius @PartaiSocmed Kta siapa? Nanti debat 5x blunder jg keok, prediksi gue yg maju putaran 2 anies vs ganjar, dn prabowo d debat akan blunder lg, 5th lalu ada d bantu sandi skrg cuma bocil yg ga punya gagasan, bkal kebalik pasca debat 5x nanti";0;0;0;0;in;1603805159557337089;1730617228884881526;Hyde_Arshavin;https://twitter.com/Hyde_Arshavin/status/1730890557579501760
Sat Dec 02 10:03:54 +0000 2023;1730890527049224347;"Pak Ganjar, semangat Anda untuk meningkatkan kualitas destinasi wisata sangat memotivasi! Dengan keterlibatan masyarakat lokal, kita akan mencapai prestasi luar biasa. @ridwanfauzi50  GPMMD 4Ende https://t.co/FEHpnn6bef";0;0;0;0;in;1691280685737349120;1730890527049224347;nabilaauli62530;https://twitter.com/nabilaauli62530/status/1730890527049224347
Sat Dec 02 10:03:53 +0000 2023;1730890520296358316;"Apresiasi tinggi untuk Pak Ganjar yang melihat potensi luar biasa pada anak muda, memastikan masa depan bangsa terjamin melalui pendidikan. @KomangWardana14  GPMMD 4Ende https://t.co/Cs3itERMnY";0;0;0;0;in;1680878331569520640;1730890520296358316;SaDarwantii;https://twitter.com/SaDarwantii/status/1730890520296358316
Sat Dec 02 10:03:51 +0000 2023;1730890512931094705;"Kita percaya, upaya Pak Ganjar dan Pak Mahfud MD akan menciptakan generasi yang handal dan mampu bersaing di tingkat global. @Fakhry__10  GPMMD 4Ende https://t.co/0NcqnxoA9l";0;0;0;0;in;1683731166598422528;1730890512931094705;FeriyNanda;https://twitter.com/FeriyNanda/status/1730890512931094705
Sat Dec 02 10:03:49 +0000 2023;1730890503774928912;"@ferizandra Langsung aja pengumuman Anies jadi presiden.   Hemat biaya.   Prabowo, Mahfud kelarin tugas jadi menteri. Gibran lanjut jd walkot.  Ganjar jalan jalan lari lari...";0;0;0;0;in;514341659;1730566890601500825;kinoyastilianti;https://twitter.com/kinoyastilianti/status/1730890503774928912
Sat Dec 02 10:03:48 +0000 2023;1730890502063710501;"Sukses selalu untuk Pak Ganjar dan Pak Mahfud MD dalam mewujudkan Indonesia yang cerdas melalui akses pendidikan yang merata. @luluthfida  GPMMD 4Ende https://t.co/0yvaDDV9e4";0;0;0;0;in;1684938088337088512;1730890502063710501;candra_candrase;https://twitter.com/candra_candrase/status/1730890502063710501
Sat Dec 02 10:03:44 +0000 2023;1730890482639843712;"@Just_dhee1203 Ganjar Pranowo, Prabowo Subianto atau Anies Rasyid Baswedan...  Semoga Ramalan Joyo Boyo isapan jempol belaka...";0;0;0;0;in;732115060844175360;1730406083402047822;cahayafikiran;https://twitter.com/cahayafikiran/status/1730890482639843712
Sat Dec 02 10:03:40 +0000 2023;1730890468266000740;"Keberanian Pak Ganjar dan Pak Mahfud MD dalam menanggulangi pelanggaran HAM berat adalah contoh nyata bahwa keadilan harus ditegakkan tanpa pandang bulu. @IzanagySofian  GPMMD 4Ende https://t.co/pNwP4EeWn4";0;0;0;0;in;1687408323208110080;1730890468266000740;PutriAm90292270;https://twitter.com/PutriAm90292270/status/1730890468266000740
Sat Dec 02 10:03:22 +0000 2023;1730890390629400622;"Harapan besar agar Pak Ganjar dan Pak Mahfud MD menjadi teladan bagi pemimpin lain untuk memprioritaskan pendidikan. @Fambitions_  GPMMD 4Ende https://t.co/aKDX13Fb9s";0;0;0;0;in;1683556256550879232;1730890390629400622;callystara_;https://twitter.com/callystara_/status/1730890390629400622
Sat Dec 02 10:03:14 +0000 2023;1730890357154677165;"@TeddGus Bukan Ganjar Mahfud blog... Yg rugi itu Erlangga, Erick, Ridwan Kamil... Yg paling sakit Erlangga krn partainya yg dibajak. Yg rugi banyak Erick. Kok Ganjar Mahfud...";0;2;0;7;in;1603374160503541760;1730888639427817897;taliwongsooo;https://twitter.com/taliwongsooo/status/1730890357154677165
Sat Dec 02 10:03:14 +0000 2023;1730890356764586060;"Terima kasih kepada Pak Ganjar dan Pak Mahfud MD yang memastikan keamanan negara dari terorisme, membuktikan bahwa keamanan rakyat adalah prioritas utama. @izzamagendra  GPMMD 4Ende https://t.co/7iOg75qHqs";0;0;0;0;in;1688559865026031616;1730890356764586060;rahmanlukman12;https://twitter.com/rahmanlukman12/status/1730890356764586060
Sat Dec 02 10:03:09 +0000 2023;1730890336325750886;"Pak Ganjar dan Pak Mahfud MD, terima kasih atas komitmen tinggi dalam melawan korupsi, menciptakan tatanan yang bersih. @hahahahseum  GPMMD 4Ende https://t.co/8eoGH1GXUB";0;0;0;0;in;1687000889725480960;1730890336325750886;febihaditiya1;https://twitter.com/febihaditiya1/status/1730890336325750886
Sat Dec 02 10:03:08 +0000 2023;1730890332617965765;"Pak Ganjar, semoga usaha Anda dalam memajukan pariwisata membawa dampak positif yang besar. Dengan perubahan kualitas dan keterlibatan masyarakat, Indonesia akan semakin gemilang. @Satrio004  GPMMD 4Ende https://t.co/uZfwNPU3Kl";0;0;0;0;in;1687037948112621568;1730890332617965765;fitriendangg;https://twitter.com/fitriendangg/status/1730890332617965765
Sat Dec 02 10:03:05 +0000 2023;1730890321578635568;"Apresiasi tinggi untuk Pak Ganjar dan Pak Mahfud MD yang berfokus pada keterlibatan masyarakat lokal. Semoga hal ini menciptakan ikatan yang erat antara wisatawan dan komunitas lokal. @Riddo_plur  GPMMD 4Ende https://t.co/mx4eG6pX5F";0;0;0;0;in;1685300300557721600;1730890321578635568;aldiantoradifan;https://twitter.com/aldiantoradifan/status/1730890321578635568
Sat Dec 02 10:03:02 +0000 2023;1730890310073618842;"@Ganjar_Mahfud03 @islah_bahrawi Tapi jokowi bisa seperti itu,  Ada andil PDIP dalam memberi fasilitas politik";0;0;0;0;in;2963337276;1730842879004975211;Quvvatt;https://twitter.com/Quvvatt/status/1730890310073618842
Sat Dec 02 10:03:00 +0000 2023;1730890301240443098;"Terharu melihat Pak Ganjar dan Pak Mahfud MD saling berkolaborasi untuk memberikan akses pendidikan kepada anak muda, sebuah bentuk kebersamaan yang patut dicontoh. @Ekowaetenan  GPMMD 4Ende https://t.co/bAGZB9S51o";0;0;0;0;in;1689129893261615104;1730890301240443098;ridhanrmdhni;https://twitter.com/ridhanrmdhni/status/1730890301240443098
Sat Dec 02 10:02:55 +0000 2023;1730890276770881553;"Sukses untuk setiap inovasi dan reformasi yang diusung oleh Pak Ganjar dan Pak Mahfud MD dalam dunia pendidikan. @faldimd_  GPMMD 4Ende https://t.co/w74GUf38AM";0;0;0;0;in;1683527466768568322;1730890276770881553;__chloesimamari;https://twitter.com/__chloesimamari/status/1730890276770881553
Sat Dec 02 10:02:49 +0000 2023;1730890252146065749;"Keinginan Pak Ganjar dan Pak Mahfud MD untuk mencerdaskan anak muda adalah tindakan luar biasa yang patut diapresiasi oleh semua. @LukmanTruno03  GPMMD 4Ende https://t.co/tIUbd5hctY";0;0;0;0;in;1684397653466169344;1730890252146065749;kusumaadi538921;https://twitter.com/kusumaadi538921/status/1730890252146065749
Sat Dec 02 10:02:42 +0000 2023;1730890223641583750;"Pak Ganjar membawa semangat baru ke dalam dunia pendidikan dengan fokus pada sekolah vokasi. Ini adalah langkah besar untuk menciptakan anak bangsa yang tangguh di berbagai bidang. @MRafiyudin11  GPMMD 4Ende https://t.co/lnV8OiS2l4";0;0;0;0;in;1689144168726274048;1730890223641583750;FikiRamadrama3;https://twitter.com/FikiRamadrama3/status/1730890223641583750
Sat Dec 02 10:02:42 +0000 2023;1730890222760759614;"Upaya Pak Ganjar dan Pak Mahfud MD dalam memperbarui destinasi wisata akan memberikan dampak positif pada industri pariwisata. Semoga ini menjadi contoh untuk daerah lainnya. @ridhoarism  GPMMD 4Ende https://t.co/ArlDf0zLGM";0;0;0;0;in;1690428603291643904;1730890222760759614;kumalaaindh;https://twitter.com/kumalaaindh/status/1730890222760759614
Sat Dec 02 10:02:35 +0000 2023;1730890195032215820;"Pengamat Nilai Program Ganjar-Mahfud Langsung Sentuh Akar Masalah  Baca Selengkapnya : https://t.co/TfBLR02qRw  #TuankuRakyat #GanjarMediaCenter #GPMDForRI1 #PanritaCommunity #PijarSulsel https://t.co/N2xomYf6ME";0;0;0;0;in;1721387261726691328;1730890195032215820;LasmuraSinjai;https://twitter.com/LasmuraSinjai/status/1730890195032215820
Sat Dec 02 10:02:29 +0000 2023;1730890169560293681;"Ganjar dan Mahfud MD memperlihatkan bahwa pendidikan yang holistik adalah kunci kesuksesan masa depan. Semoga inisiatif ini menjadi model untuk daerah lain di Indonesia. @mozarellabread  GPMMD 4Ende https://t.co/gi2eiqB6Zv";0;0;0;0;in;1688395405460180993;1730890169560293681;luna_cantikaaa;https://twitter.com/luna_cantikaaa/status/1730890169560293681
Sat Dec 02 10:02:19 +0000 2023;1730890129294987602;"Pak Ganjar, semangat Anda untuk mencapai target 30 juta wisatawan mancanegara adalah tantangan yang menginspirasi! Mari bersama-sama raih prestasi besar untuk Indonesia. @satriafjrr  GPMMD 4Ende https://t.co/R2S0x8PY1x";0;0;0;0;in;1686985864776482816;1730890129294987602;alvarooooagm;https://twitter.com/alvarooooagm/status/1730890129294987602
Sat Dec 02 10:02:16 +0000 2023;1730890115294371985;"@PocoRedmip3397 @sepedatua74 @kurawa Heleh https://t.co/qvMuy8dA7S lagi.dlu mbak puan jg pernah ngomong kl MK mengabulkan putusan itu Gibran jg bsa maju jadi cawapresnya Ganjar cmn gegara nenek gengsi aj ma Jokowi jadi menunjuk p Mahfud.coba JD cawapresnya Ganjar isu MK ini ga akan d ungkit trs🤣";0;1;0;0;in;1495618492111884289;1730779585728655799;nana140920;https://twitter.com/nana140920/status/1730890115294371985
Sat Dec 02 10:02:15 +0000 2023;1730890109044805732;"@bukanbuzzerRp @CNNIndonesia Berarti kalo e-ktp nanya nya harus langsung ke ganjar jngan ke kaesang gitu toh maksudnya";0;2;0;3;in;1629573139104665600;1730849396999512366;rsky24269681;https://twitter.com/rsky24269681/status/1730890109044805732
