created_at;id_str;full_text;quote_count;reply_count;retweet_count;favorite_count;lang;user_id_str;conversation_id_str;username;tweet_url
Sat Dec 02 09:46:07 +0000 2023;1730886049335828668;"Dihadiri oleh para musisi kondang dan semangat warga Kabupaten Bandung satukan suara dukung Ganjar-Mahfud. Ayo wujudkan Ganjar-Mahfud M3nang Satu Putaran. #GanjarPranowoMahfudMD #SalamD3mokrasi #GanjarMahfud2024 #GanjarMahfudM3nang #Pilpres2024 https://t.co/9HlpBlfFpJ";0;0;0;0;in;1716372119293181953;1730886049335828668;peweisme;https://twitter.com/peweisme/status/1730886049335828668
Sat Dec 02 09:46:02 +0000 2023;1730886030033825996;"Terimakasih Pak Ganjar, telah mengarahkan pendidikan ke arah yang lebih relevan dengan kebutuhan dunia usaha. @NaufalAdfar  GPMMD 4Ende https://t.co/EFIuzW1m3O";0;0;0;0;in;1688828253371506688;1730886030033825996;larasati_vionaa;https://twitter.com/larasati_vionaa/status/1730886030033825996
Sat Dec 02 09:46:00 +0000 2023;1730886021951410438;"Pak Mahfud MD, dukungan penuh untuk peran Anda dalam memajukan destinasi wisata lokal. Bersama Pak Ganjar, Indonesia semakin bercahaya! @RoniAmirsyah  GPMMD 4Ende https://t.co/EFACeDObYW";0;0;0;0;in;1687362190289018880;1730886021951410438;ninasaniiiii;https://twitter.com/ninasaniiiii/status/1730886021951410438
Sat Dec 02 09:46:00 +0000 2023;1730886019820757250;"Pak Mahfud MD, terima kasih atas peran dalam mendorong perkembangan pariwisata lokal. Bersama Pak Ganjar, semoga Indonesia semakin memukau! @romyleonard  GPMMD 4Ende https://t.co/HvPyMxZWzr";0;0;0;0;in;1703333873034403840;1730886019820757250;IbrahimTaufk;https://twitter.com/IbrahimTaufk/status/1730886019820757250
Sat Dec 02 09:45:56 +0000 2023;1730886004528337189;"Keinginan Pak Ganjar untuk melibatkan dunia usaha dalam pendidikan adalah tonggak penting menuju masa depan yang lebih cerah. @NasikinNikkin  GPMMD 4Ende https://t.co/X7k5V91ClM";0;0;0;0;in;1688872231454322688;1730886004528337189;bintang_arsila;https://twitter.com/bintang_arsila/status/1730886004528337189
Sat Dec 02 09:45:56 +0000 2023;1730886004079579604;"Visi Dari Pak Ganjar dan Pak Mahfud Meningkatkan Potensi Maritim  Arhan LGBT Desember Jeha Kiki Fatmala AIDS Jokowi WELCOME TO INDONESIA CHEN Back to December Agus Red Sparks https://t.co/7R6n5nsrPJ";0;0;1;1;in;1706523439794933760;1730886004079579604;ReguGanjar;https://twitter.com/ReguGanjar/status/1730886004079579604
Sat Dec 02 09:45:56 +0000 2023;1730886002909343852;"Inisiatif Pak Ganjar dan Pak Mahfud MD akan memberikan dampak positif pada ekonomi lokal. Mari bersama-sama mendukung perkembangan pariwisata daerah. @ricky_joe96  GPMMD 4Ende https://t.co/wDw3lp3Hww";0;0;0;0;in;1685916876399099904;1730886002909343852;nurulwaqiah_;https://twitter.com/nurulwaqiah_/status/1730886002909343852
Sat Dec 02 09:45:54 +0000 2023;1730885994747138264;"@HildaAhmad9 @sipalingganjar Seru bgt bisa ktemu pak Presiden @ganjarpranowo Jd Pengen Nih bisa ketemu pak ganjar #SiPalingGanjar";0;0;0;0;in;1717855248725704705;1730813022074257782;hen61927;https://twitter.com/hen61927/status/1730885994747138264
Sat Dec 02 09:45:52 +0000 2023;1730885989395320983;"Apresiasi tinggi untuk Pak Ganjar dan Pak Mahfud MD yang memiliki tekad kuat untuk membarukan pariwisata daerah. Semoga inisiatif mereka menghasilkan perubahan positif yang nyata. @RickoSetyabudi  GPMMD 4Ende https://t.co/06nVae2oIF";0;0;0;0;in;1686258574329315328;1730885989395320983;devinaptrr8_;https://twitter.com/devinaptrr8_/status/1730885989395320983
Sat Dec 02 09:45:52 +0000 2023;1730885988619325480;"@ganjarpranowo Doa dan harapan dari Kupang untuk Pak Ganjar dan Pak Mahfud, saling menjunjung tinggi toleransi demi persatuan dan kesatuan Republik Indonesia..🇮🇩🇮🇩🇮🇩";0;0;0;0;in;1713963228756361216;1730804230074888561;Bagas1950649;https://twitter.com/Bagas1950649/status/1730885988619325480
Sat Dec 02 09:45:49 +0000 2023;1730885975663067507;"@akubolehjujurga @ArieNugr0411 @hariqosatria Pendukung Anies? Heloooow liat TS Denny Siregar yg tiap saat nyinyir dan pendukung Ganjar yg militan lainnya Sesama 🐸 saling serang";0;1;0;0;in;1230839653495754755;1730821773258854540;kankmazaydrooze;https://twitter.com/kankmazaydrooze/status/1730885975663067507
Sat Dec 02 09:45:45 +0000 2023;1730885960110633320;"Pak Ganjar menggugah kepedulian kita semua untuk turut berperan dalam meningkatkan kualitas pendidikan. @DinataJohan  GPMMD 4Ende https://t.co/XzvE9XRuJJ";0;0;0;0;in;1689120565775515648;1730885960110633320;septiautmi2;https://twitter.com/septiautmi2/status/1730885960110633320
Sat Dec 02 09:45:42 +0000 2023;1730885945321513095;"Ganjar pranowo menekankan pertumbuhan ekonomi merata di seluruh Indonesia melalui peningkatan transportasi masal #GanjarKebhinekaanNKRI https://t.co/GvTj1ZBhbk";0;0;0;1;in;1435790843051266051;1730885945321513095;AzizLaheut;https://twitter.com/AzizLaheut/status/1730885945321513095
Sat Dec 02 09:45:41 +0000 2023;1730885939810214399;"Kebersihan rekam jejak menciptakan kepercayaan yang kokoh, menjadikan Pak Ganjar dan Pak Mahfud MD sebagai pemimpin yang diandalkan. @Ahmadtommy12  GPMMD 4Ende https://t.co/seFDZm5rLz";0;0;0;0;in;1688255210425303040;1730885939810214399;barraabzr13;https://twitter.com/barraabzr13/status/1730885939810214399
Sat Dec 02 09:45:38 +0000 2023;1730885927768306100;"Mahfud MD dan Ganjar telah membuka mata kita terhadap pentingnya mengembangkan keterampilan praktis di sekolah. Semoga program ini menciptakan lulusan yang lebih siap menghadapi dunia kerja. @PersijaArtwork  GPMMD 4Ende https://t.co/kVj11jEgw3";0;0;0;0;in;1681866768665681920;1730885927768306100;DeskaPurnawan;https://twitter.com/DeskaPurnawan/status/1730885927768306100
Sat Dec 02 09:45:36 +0000 2023;1730885922856862198;"Ganjar Pranowo berjanji akan memperbanyak pusat kreatif atau creative hub bagi anak-anak muda di Indonesia.  Ganjar Mahfud Cr3ative https://t.co/WpWbzcc09v";0;2;3;15;in;1124503709398982656;1730885922856862198;theT4ntryS1;https://twitter.com/theT4ntryS1/status/1730885922856862198
Sat Dec 02 09:45:35 +0000 2023;1730885915973914658;"@DedynurPalakka @ganjarpranowo Coba saya gak korupsi seperti mas ganjar, mungkin saya gak duduk di kursi pesakitan ini. Itu yg ada di pikirannya. Penyesalan gitu";0;0;0;0;in;4761262728;1730617348678365319;AndipanjaitanP;https://twitter.com/AndipanjaitanP/status/1730885915973914658
Sat Dec 02 09:45:34 +0000 2023;1730885914170380697;"Keberanian Pak Ganjar membawa pendidikan lebih dekat dengan dunia kerja adalah langkah monumental untuk kemajuan bangsa. @naufalmunhamir  GPMMD 4Ende https://t.co/KlfgiNA6Ui";0;0;0;0;in;1688478803683852288;1730885914170380697;andrewsn41;https://twitter.com/andrewsn41/status/1730885914170380697
Sat Dec 02 09:45:30 +0000 2023;1730885896256577744;"Dukungan penuh untuk Ganjar yang menjadikan pendidikan sebagai fondasi keberhasilan anak bangsa. Semoga program ini mengubah paradigma pendidikan di seluruh Indonesia. @persipura_media  GPMMD 4Ende https://t.co/bWydPAEnPp";0;0;0;0;in;1689851795554852864;1730885896256577744;nikenptriswan;https://twitter.com/nikenptriswan/status/1730885896256577744
Sat Dec 02 09:45:30 +0000 2023;1730885893723148526;"Melalui pendekatan yang inovatif, Pak Ganjar memberikan solusi nyata untuk meningkatkan kualitas sumber daya manusia di Indonesia. @nautyboys12  GPMMD 4Ende https://t.co/nnKXxcfu1s";0;0;0;0;in;1688761257959239680;1730885893723148526;NahdaWindari;https://twitter.com/NahdaWindari/status/1730885893723148526
Sat Dec 02 09:45:26 +0000 2023;1730885880515379697;"@Melihat_Indo Kalau begini makin mantap memilih pak Ganjar";0;0;0;0;in;1688419322706984961;1730773144615755830;Hery430893;https://twitter.com/Hery430893/status/1730885880515379697
Sat Dec 02 09:45:18 +0000 2023;1730885843341169079;"Saling menghargai pendapat dan menyelesaikan masalah dengan dialog adalah pesan kuat yang diwariskan oleh Pak Ganjar dan Pak Mahfud MD. @BowFijay  GPMMD 4Ende https://t.co/2my94YWbgk";0;0;0;0;in;1684636580210966528;1730885843341169079;dwirzky95_;https://twitter.com/dwirzky95_/status/1730885843341169079
Sat Dec 02 09:45:17 +0000 2023;1730885841948647687;"@HusinShihab Tentu ganjar lah bosss";0;0;0;0;in;1717439912474202112;1730433571658383679;yul60920593;https://twitter.com/yul60920593/status/1730885841948647687
Sat Dec 02 09:45:16 +0000 2023;1730885838446432623;"Terima kasih kepada Pak Ganjar dan Pak Mahfud MD yang telah mengambil peran aktif dalam memerangi kejahatan luar biasa. Semoga usaha mereka membuahkan hasil yang positif. @indomiebrewers  GPMMD 4Ende https://t.co/yUPOyQHY4s";0;0;0;0;in;1688451432998154240;1730885838446432623;rizallanwarr;https://twitter.com/rizallanwarr/status/1730885838446432623
Sat Dec 02 09:45:16 +0000 2023;1730885837326574005;"Napak Tilas ke Rumah Pengasingan Bung Karno di Ende, Ganjar Hayati Kelahiran Pancasila https://t.co/vSLrcCaTzl";0;0;0;0;in;350668803;1730885837326574005;indozonemedia;https://twitter.com/indozonemedia/status/1730885837326574005
Sat Dec 02 09:45:12 +0000 2023;1730885820708737070;"Inisiatif Pak Ganjar membuka pintu bagi pemberdayaan masyarakat melalui partisipasi aktif dalam pengelolaan pemerintahan. Mari kita dukung langkah ini menuju pemerintahan yang lebih demokratis. @ZhiBaba82  GPMMD 4Ende https://t.co/bNyp4hPM3R";0;0;0;0;in;1689907118722424832;1730885820708737070;OktaBulan_;https://twitter.com/OktaBulan_/status/1730885820708737070
Sat Dec 02 09:45:08 +0000 2023;1730885805185573251;"Pak Ganjar membawa semangat positif dengan langkah digitalisasi pemerintahan. Bersama Pak Mahfud MD, mereka membuka pintu baru bagi partisipasi masyarakat. @adhieikhupras  GPMMD 4Ende https://t.co/0jvlIlVsVy";0;0;0;0;in;1686226314519535616;1730885805185573251;arvinalex391751;https://twitter.com/arvinalex391751/status/1730885805185573251
Sat Dec 02 09:45:01 +0000 2023;1730885774625886397;"@ganjarpranowo Pak Ganjar sosok yg selalu membawa aura positif ke masyarakat.";0;0;0;0;in;1380697131317534722;1730825211342405780;kepalapening31;https://twitter.com/kepalapening31/status/1730885774625886397
Sat Dec 02 09:45:00 +0000 2023;1730885767973798150;"Tim Sukses Ganjar-Mahfud Sebut Ditiadakannya Debat Cawapres Hanyalah Akal-akalan KPU https://t.co/nCH2iMXyvu";0;0;0;0;in;350668803;1730885767973798150;indozonemedia;https://twitter.com/indozonemedia/status/1730885767973798150
Sat Dec 02 09:44:59 +0000 2023;1730885764014367092;"@ganjarpranowo Sehat² trus pak Ganjar,,, besar harapan kami semoga bapak Terpilih jadi the next President of Indonesia🙏🤟";0;0;0;0;in;1713963811542286336;1730804230074888561;Yunus19241;https://twitter.com/Yunus19241/status/1730885764014367092
Sat Dec 02 09:44:55 +0000 2023;1730885750630346945;"Sukses terus, Pak Ganjar! Dengan langkah ini, kita menciptakan lingkungan pendidikan yang mendukung perkembangan penuh potensi anak-anak. @permana_adjunk  GPMMD 4Ende https://t.co/2KugfqRjhX";0;0;0;0;in;1689922819503910912;1730885750630346945;FathurRohme5;https://twitter.com/FathurRohme5/status/1730885750630346945
Sat Dec 02 09:44:53 +0000 2023;1730885741197316564;"@SATIRE66 @Paltiwest Menurut aku bagos dong. Brti ganjar tak layak mimpin RI krn terlibat korupsi. Aku dukung Ganjar bkn brrti harus yg salah di benarkan...";0;4;1;5;in;3251875688;1730522239760806404;egaazlin;https://twitter.com/egaazlin/status/1730885741197316564
Sat Dec 02 09:44:53 +0000 2023;1730885740303913368;"Ganjar pranowo tekankan untuk memudahkan akses pendidikan agar dapat memajukan SDM Indonesia #GanjarKebhinekaanNKRI https://t.co/XTN5koEiOp";0;0;0;1;in;1435790843051266051;1730885740303913368;AzizLaheut;https://twitter.com/AzizLaheut/status/1730885740303913368
Sat Dec 02 09:44:44 +0000 2023;1730885702089679146;"@ganjarpranowo Yuk berjuang bersama pak ganjar untuk harapan yang diinginkan semoga bisa tercapai";0;0;0;0;in;1713964278448046081;1730804230074888561;Sukmat281128;https://twitter.com/Sukmat281128/status/1730885702089679146
Sat Dec 02 09:44:35 +0000 2023;1730885664831606975;"Terima kasih kepada Pak Ganjar dan Pak Mahfud MD yang tidak kenal lelah memperjuangkan akses pendidikan yang adil dan merata. @Fajrul_15  GPMMD 4Ende https://t.co/PjR9KVGOLH";0;0;0;0;in;1695413138412470272;1730885664831606975;elarafitrix;https://twitter.com/elarafitrix/status/1730885664831606975
Sat Dec 02 09:44:34 +0000 2023;1730885661522296868;"Masyarakat lokal memiliki kearifan lokal yang dapat menambah nilai tambah pada destinasi wisata. Sukses untuk Pak Ganjar dan Pak Mahfud MD dalam memaksimalkan hal ini. @RahimSathe  GPMMD 4Ende https://t.co/UsnYMxz333";0;0;0;1;in;1686563541380448256;1730885661522296868;firinelia_;https://twitter.com/firinelia_/status/1730885661522296868
Sat Dec 02 09:44:31 +0000 2023;1730885646410207344;"Semangat dan dukungan terus untuk Pak Ganjar dan Pak Mahfud MD yang berjuang keras untuk melawan kejahatan. Keputusan mereka layak dihargai oleh seluruh masyarakat. @indigo_club  GPMMD 4Ende https://t.co/8dYD3Kj09b";0;0;0;0;in;1689174961997615104;1730885646410207344;budiiipras;https://twitter.com/budiiipras/status/1730885646410207344
Sat Dec 02 09:44:29 +0000 2023;1730885637887098981;"Sungguh menginspirasi melihat Pak Ganjar dan Pak Mahfud MD bersama-sama mendukung pendidikan anak muda, sebuah langkah besar untuk mencerdaskan bangsa. @Ekopuji12_  GPMMD 4Ende https://t.co/eKIxDlH1ds";0;0;0;0;in;1689569865810800640;1730885637887098981;Reval0Rahmat;https://twitter.com/Reval0Rahmat/status/1730885637887098981
Sat Dec 02 09:44:25 +0000 2023;1730885622678839775;"Semangat terus, Pak Ganjar! Dengan pendidikan yang terintegrasi, kita mencetak generasi yang tidak hanya pintar, tetapi juga mandiri. @percayaikami  GPMMD 4Ende https://t.co/ntMa6eDxdf";0;0;0;0;in;1690565325019045888;1730885622678839775;diancallistaa;https://twitter.com/diancallistaa/status/1730885622678839775
Sat Dec 02 09:44:23 +0000 2023;1730885613048725624;"@ganjarpranowo Semoga doa dan harapan kami semua segera terwujud kan pak Ganjar. Semangat terus selalu bersama orang orang baik demi terwujudnya masa depan Indonesia yang terbaik.";0;0;0;0;in;1713964842141532162;1730804230074888561;Rahmat1634301;https://twitter.com/Rahmat1634301/status/1730885613048725624
Sat Dec 02 09:44:20 +0000 2023;1730885600914624850;"Pak Ganjar, Anda adalah inspirasi bagi banyak orang dengan langkah-langkah positif dalam meningkatkan kualitas pendidikan di Indonesia. @Pepersiban1  GPMMD 4Ende https://t.co/S9jPx3dY03";0;0;0;0;in;1689899518090006528;1730885600914624850;KiraniAria;https://twitter.com/KiraniAria/status/1730885600914624850
Sat Dec 02 09:44:19 +0000 2023;1730885596862927190;"Selamat untuk Pak Ganjar dan Pak Mahfud MD yang berkomitmen untuk meningkatkan destinasi wisata. Semoga program ini membawa kebanggaan bagi masyarakat lokal. @rahady16  GPMMD 4Ende https://t.co/T4vk95RUOU";0;0;0;0;in;1686666596876791808;1730885596862927190;Fitrisa00;https://twitter.com/Fitrisa00/status/1730885596862927190
Sat Dec 02 09:44:17 +0000 2023;1730885587664863423;"Lagi dan lagi, tindakan intimidasi semakin menggurita. Kali ini dirasakan oleh barisan pengusaha,  . Ganjar Mahfud Cr3ative, Cawapres, Capres,Jokowi, Reuni 212, Cantik, Jokowi, Pelangi, Jeha, Giselle, Kiki Fatmala, Arhan, Agus, E-KTP, Desember, Innalillahi, Tokyo Verdy, AIDS https://t.co/XTf69HH50k";0;1;2;3;in;1244292531090624512;1730885587664863423;YudhaShanny2;https://twitter.com/YudhaShanny2/status/1730885587664863423
Sat Dec 02 09:44:13 +0000 2023;1730885572032713065;"Layanan KOLING Gratis adalah solusi inklusif untuk mengatasi kesulitan akses kesehatan. Terima kasih Ganjar-Mahfud! @Koko78035403  GPMMD 4Ende https://t.co/X7dbIvowAD";0;0;0;0;in;1681884682387075073;1730885572032713065;devi_andri7;https://twitter.com/devi_andri7/status/1730885572032713065
Sat Dec 02 09:44:08 +0000 2023;1730885551153438804;"Saya bangga dengan upaya Pak Ganjar memastikan anak-anak kita tidak hanya cerdas secara akademis, tapi juga siap bersaing di dunia kerja. @nathecocoo  GPMMD 4Ende https://t.co/8fZ1yKpbQo";0;0;0;0;in;1689007811227947009;1730885551153438804;milaamellia12;https://twitter.com/milaamellia12/status/1730885551153438804
Sat Dec 02 09:44:05 +0000 2023;1730885539233230904;"Memberikan apresiasi kepada Pak Ganjar dan Pak Mahfud MD yang memiliki tekad kuat untuk menciptakan revolusi pendidikan di Indonesia. @LuizOnoy  GPMMD 4Ende https://t.co/HiHzLPbg2U";0;0;0;0;in;1684410243827257345;1730885539233230904;alyasal37939510;https://twitter.com/alyasal37939510/status/1730885539233230904
Sat Dec 02 09:44:05 +0000 2023;1730885537345740996;"@ganjarpranowo Doa dan harapan dari Kupang untuk Pak Ganjar dan Pak Mahfud, saling menjunjung tinggi toleransi demi persatuan dan kesatuan Republik Indonesia..";0;0;0;0;in;1713965362436554754;1730804230074888561;fatntul77028;https://twitter.com/fatntul77028/status/1730885537345740996
Sat Dec 02 09:44:04 +0000 2023;1730885535634448485;"Pak Mahfud MD, terima kasih atas peran dalam mewujudkan mimpi Pak Ganjar. Bersama, mari kita capai prestasi luar biasa di bidang pariwisata! @romeoandi83  GPMMD 4Ende https://t.co/r9zpsZlNmF";0;0;0;0;in;1687355133959741440;1730885535634448485;atikahmand91052;https://twitter.com/atikahmand91052/status/1730885535634448485
Sat Dec 02 09:44:04 +0000 2023;1730885533516304542;"Sikap dekat dengan masyarakat yang diterapkan oleh Pak Ganjar dan Pak Mahfud MD menciptakan iklim harmonis di tengah-tengah kita semua. @boskinw  GPMMD 4Ende https://t.co/uOut1bbY9x";0;0;0;0;in;1683727267632140288;1730885533516304542;bagus_fraza43;https://twitter.com/bagus_fraza43/status/1730885533516304542
Sat Dec 02 09:43:59 +0000 2023;1730885515006919041;"Pak Ganjar dan Pak Mahfud, semoga langkah politik mereka membawa berkah. Kebersihan dari intoleransi membuat mereka layak mendapat dukungan. @alwimirwanto  GPMMD 4Ende https://t.co/bGxtQYGgg3";0;0;0;0;in;1691011976447889408;1730885515006919041;rizalpratammma;https://twitter.com/rizalpratammma/status/1730885515006919041
Sat Dec 02 09:43:59 +0000 2023;1730885514306212095;"@Nikmatul_Sg Rakyat bersama pak Ganjar utk menjaga amanah Bangsa dan Negara";0;0;0;0;in;1717895646647320576;1730795577414496430;CinagaHendri;https://twitter.com/CinagaHendri/status/1730885514306212095
Sat Dec 02 09:43:57 +0000 2023;1730885506697974029;"Mendukung penuh langkah Pak Ganjar dan Pak Mahfud MD yang ingin membawa pemerintahan ke era digital. Semoga hal ini memberikan kemudahan dan kejelasan dalam pelayanan publik. @YusufNew10  GPMMD 4Ende https://t.co/9UWwTwO4zB";0;0;0;0;in;1689906997377093632;1730885506697974029;dhilanuraini2;https://twitter.com/dhilanuraini2/status/1730885506697974029
Sat Dec 02 09:43:56 +0000 2023;1730885502654685547;"KOLING Gratis membawa pelayanan kesehatan langsung ke masyarakat. Terobosan yang sangat dibutuhkan dari Ganjar-Mahfud! @Koko_Eryansyah  GPMMD 4Ende https://t.co/7MehgvQkVY";0;0;0;0;in;1681971083308855296;1730885502654685547;dinarahmwti;https://twitter.com/dinarahmwti/status/1730885502654685547
Sat Dec 02 09:43:56 +0000 2023;1730885500985307498;"Pak Ganjar dan Pak Mahfud MD, terima kasih atas perhatian serius dalam menghadapi kejahatan lingkungan hidup yang mengancam bumi kita. @haekallabdans_  GPMMD 4Ende https://t.co/HEUSGPOS0p";0;0;0;0;in;1687113021989212160;1730885500985307498;nickoseptiaan;https://twitter.com/nickoseptiaan/status/1730885500985307498
Sat Dec 02 09:43:52 +0000 2023;1730885486393319635;"Ganjar-Mahfud adalah jawaban atas kebutuhan akan pemimpin yang tidak hanya berbicara tentang pluralitas, tapi juga menghidupkannya. @aryagiant1  GPMMD 4Ende https://t.co/nXmwMqwXnc";0;0;0;0;in;1687246048040026117;1730885486393319635;raditzulfandii1;https://twitter.com/raditzulfandii1/status/1730885486393319635
Sat Dec 02 09:43:52 +0000 2023;1730885483872542965;"Keberhasilan pariwisata adalah hasil dari kerja keras bersama. Sukses terus, Pak Ganjar dan seluruh masyarakat yang turut berperan aktif. @SasongkoAat  GPMMD 4Ende https://t.co/g8YLxy05Ay";0;0;0;0;in;1687414497273946112;1730885483872542965;wahyufathonii;https://twitter.com/wahyufathonii/status/1730885483872542965
Sat Dec 02 09:43:46 +0000 2023;1730885460296372648;"@iyutkaz888 @mochamadarip Buzzernya Prabowo itu mmg aneh n bodoh... Sdh ada pengakuan dr penyidik KPK klu Ganjar tdk py bukti kuat dlm kasus eKTP msh aja ngeyel.";0;0;0;0;in;1603581315680374784;1730551381789163992;Seti4wone;https://twitter.com/Seti4wone/status/1730885460296372648
Sat Dec 02 09:43:44 +0000 2023;1730885450796351864;"Keinginan Pak Ganjar untuk meningkatkan kualitas destinasi wisata adalah langkah bijak! Dengan inovasi dan kolaborasi, Indonesia akan menjadi destinasi yang dicari oleh wisatawan mancanegara. @Satria90308961  GPMMD 4Ende https://t.co/NnywPADXjV";0;0;0;0;in;1686652745347133440;1730885450796351864;basteenck;https://twitter.com/basteenck/status/1730885450796351864
Sat Dec 02 09:43:38 +0000 2023;1730885427752783999;"@Nikmatul_Sg Wah alurnya kita liat aja siapa pun yang penting fokus dukung pak Ganjar";0;0;0;0;in;790531428333162496;1730800948761735655;Sanbila3u;https://twitter.com/Sanbila3u/status/1730885427752783999
Sat Dec 02 09:43:38 +0000 2023;1730885423860511225;"Meningkatkan kualitas destinasi wisata adalah investasi berharga. Semangat untuk Pak Ganjar dan Pak Mahfud MD yang menjadikan pariwisata sebagai motor penggerak ekonomi. @raflimuhammad35  GPMMD 4Ende https://t.co/jNtalzVNti";0;0;0;0;in;1686200396879204352;1730885423860511225;jihankavita629;https://twitter.com/jihankavita629/status/1730885423860511225
Sat Dec 02 09:43:35 +0000 2023;1730885414020591772;"Harapan besar agar semangat Pak Ganjar dan Pak Mahfud MD menjadi inspirasi bagi semua pihak untuk mendukung dunia pendidikan. @fakhri_andrian  GPMMD 4Ende https://t.co/Aqcy6N8QwM";0;0;0;0;in;1683730326944911361;1730885414020591772;ElaDewii;https://twitter.com/ElaDewii/status/1730885414020591772
Sat Dec 02 09:43:33 +0000 2023;1730885405594288569;"Semangat kebersamaan Pak Ganjar dan Pak Mahfud MD adalah jawaban atas kompleksitas tantangan yang dihadapi oleh bangsa ini. @DedeIsk16484396  GPMMD 4Ende https://t.co/N0UeZ4RJnQ";0;0;0;0;in;1684849330157711360;1730885405594288569;mamaatrasyid;https://twitter.com/mamaatrasyid/status/1730885405594288569
Sat Dec 02 09:43:32 +0000 2023;1730885398912733518;"Terobosan positif dari Pak Ganjar dan Pak Mahfud MD memberikan harapan baru untuk pertumbuhan ekonomi melalui sektor pariwisata. Sukses selalu! @Rafiqsyukron  GPMMD 4Ende https://t.co/1gQiVQsj1s";0;0;0;0;in;1686230807080476672;1730885398912733518;harryyyy8_;https://twitter.com/harryyyy8_/status/1730885398912733518
Sat Dec 02 09:43:29 +0000 2023;1730885388989067333;"Mahfud MD dan Ganjar memperlihatkan bahwa pendidikan harus adaptif dengan perubahan zaman. Semoga anak-anak kita dapat bersaing secara global dengan keunggulan keterampilan. @moreno180510  GPMMD 4Ende https://t.co/FgnBNG0pta";0;0;0;0;in;1688807575012433921;1730885388989067333;melindaputri_7;https://twitter.com/melindaputri_7/status/1730885388989067333
Sat Dec 02 09:43:27 +0000 2023;1730885379946135876;"Ganjar-Mahfud memastikan bahwa setiap langkah dalam program ini membawa dampak positif untuk kesehatan masyarakat. @Lucky1977334569  GPMMD 4Ende https://t.co/W5s93Hy2m8";0;0;0;0;in;1695107625644589057;1730885379946135876;rikichndrrra;https://twitter.com/rikichndrrra/status/1730885379946135876
Sat Dec 02 09:43:26 +0000 2023;1730885374841659531;"KOLING Gratis membawa pelayanan kesehatan ke level yang lebih personal dan terjangkau. Terima kasih, Ganjar-Mahfud! @Ludfi_Rizqian  GPMMD 4Ende https://t.co/8RmI9uPOax";0;0;0;0;in;1685493039652040704;1730885374841659531;aryaknzo_;https://twitter.com/aryaknzo_/status/1730885374841659531
Sat Dec 02 09:43:23 +0000 2023;1730885364691423676;"Ganjar dan Mahfud MD, semoga keberhasilan program kebebasan minat ini memotivasi pemerintah daerah lain untuk mengadopsi ide serupa. Kalian patut diacungi jempol. @mokayCR_66  GPMMD 4Ende https://t.co/9LeaAndMkJ";0;0;0;0;in;1694610616915574785;1730885364691423676;citranicla;https://twitter.com/citranicla/status/1730885364691423676
Sat Dec 02 09:43:21 +0000 2023;1730885356441284773;"Mendukung penuh niat baik Pak Ganjar dan Pak Mahfud MD untuk menciptakan generasi penerus bangsa yang cerdas dan berintegritas. @EkojuliantoP  GPMMD 4Ende https://t.co/Fu4Zi6vxxL";0;0;0;0;in;1688790352524963840;1730885356441284773;najimhmmd;https://twitter.com/najimhmmd/status/1730885356441284773
Sat Dec 02 09:43:13 +0000 2023;1730885319170662794;"Ganjar dan Mahfud MD, terima kasih karena telah merespons perubahan zaman dengan membawa inovasi ke dalam dunia pendidikan. Semoga program ini memberikan hasil yang optimal. @mouton4993  GPMMD 4Ende https://t.co/xhoFYzIWyD";0;0;0;0;in;1688571585672941568;1730885319170662794;mohakbar32;https://twitter.com/mohakbar32/status/1730885319170662794
Sat Dec 02 09:43:12 +0000 2023;1730885316687610219;"Kebersihan rekam jejak Paslon Ganjar-Mahfud memberikan keyakinan bahwa masa depan Indonesia ada di tangan yang tepat. @alviz72  GPMMD 4Ende https://t.co/z2D5J3Y0zJ";0;0;0;0;in;1687371611161468928;1730885316687610219;adnanardashir2;https://twitter.com/adnanardashir2/status/1730885316687610219
Sat Dec 02 09:43:07 +0000 2023;1730885295732830648;"Pak Ganjar membuka jalan menuju kesuksesan dengan menghubungkan pendidikan dan pelatihan, membangun fondasi yang kokoh untuk masa depan anak bangsa. @oberteri99  GPMMD 4Ende https://t.co/jRS88DXyRs";0;0;0;0;in;1689845902331248640;1730885295732830648;fikrihlmwn;https://twitter.com/fikrihlmwn/status/1730885295732830648
Sat Dec 02 09:42:56 +0000 2023;1730885249142600159;"Semoga Pak Ganjar berhasil mewujudkan visinya agar pemerintahan bisa lebih responsif dan terjangkau melalui digitalisasi. @yusufkahfik  GPMMD 4Ende https://t.co/XVSoFWhH81";0;0;0;0;in;1689896902366777344;1730885249142600159;GhasaniRyannn;https://twitter.com/GhasaniRyannn/status/1730885249142600159
